{
  "id": "omissionDetective",
  "title": "What's Missing?",
  "subtitle": "Dialogue context and implied subjects",
  "description": "Short dialogue to infer omitted subjects, objects, or roles.",
  "difficulty": "N4-N3",
  "diagnosticTags": [
    "dialogue_context",
    "implication",
    "omitted_object",
    "omitted_recipient",
    "omitted_subject"
  ],
  "questions": [
    {
      "id": "od_001",
      "type": "multipleChoice",
      "prompt": "誰がメールを送りましたか。",
      "promptEn": "Who sent me an email?",
      "japanese": "A: 「田中さんにメールした？」\nB: 「うん、もう送ったよ。」",
      "japaneseEn": "A: \"Do you email Mr. Tanaka?\"\nB: “Yes, I sent it again.",
      "correctAnswerId": "b",
      "explanation": "Bが「送った」と答えており、主語は聞き手のB。",
      "explanationEn": "B answered, and the subject is B.",
      "diagnosticTags": [
        "omitted_subject",
        "dialogue_context"
      ],
      "context": "友人同士。",
      "contextEn": "Friends",
      "jlptLevel": "N4",
      "difficultyScore": 1,
      "grammarPoints": [
        "省略された成分の推定",
        "会話文脈からの照応"
      ],
      "vocabulary": [
        "田中さんにメールした",
        "うん",
        "もう送ったよ"
      ],
      "reviewStatus": "draft",
      "choices": [
        {
          "id": "a",
          "label": "A",
          "labelEn": "A"
        },
        {
          "id": "b",
          "label": "B",
          "labelEn": "B"
        },
        {
          "id": "c",
          "label": "田中さん",
          "labelEn": "田中さん (Mr. Tanaka)"
        },
        {
          "id": "d",
          "label": "分からない",
          "labelEn": "分からない (I don't know)"
        }
      ]
    },
    {
      "id": "od_002",
      "type": "multipleChoice",
      "prompt": "誰が洗い物をしますか。",
      "promptEn": "Who washes?",
      "japanese": "A: 「洗い物、私がやるよ。」\nB: 「ありがとう、お願い。」",
      "japaneseEn": "A: \"Wash, I do.  \nB: \"Thank you, please.",
      "correctAnswerId": "a",
      "explanation": "Aが志願して主語はA。Bは感謝しているだけ。",
      "explanationEn": "A is the subject of A. B is thankful.",
      "diagnosticTags": [
        "omitted_subject",
        "dialogue_context"
      ],
      "context": "家で。",
      "contextEn": "Home",
      "jlptLevel": "N4",
      "difficultyScore": 1,
      "grammarPoints": [
        "省略された成分の推定",
        "会話文脈からの照応"
      ],
      "vocabulary": [
        "洗い物",
        "私がやるよ",
        "ありがとう",
        "お願い"
      ],
      "reviewStatus": "draft",
      "choices": [
        {
          "id": "a",
          "label": "A",
          "labelEn": "A"
        },
        {
          "id": "b",
          "label": "B",
          "labelEn": "B"
        },
        {
          "id": "c",
          "label": "母",
          "labelEn": "母 (Mother)"
        },
        {
          "id": "d",
          "label": "分からない",
          "labelEn": "分からない (I don't know)"
        }
      ]
    },
    {
      "id": "od_003",
      "type": "multipleChoice",
      "prompt": "誰が会議室を予約しましたか。",
      "promptEn": "Who booked a meeting room?",
      "japanese": "A: 「会議室、取っとく？」\nB: 「うん、もう取った。」",
      "japaneseEn": "A: “Meeting Room, Motaku?”\nB: “Yes, I took it.",
      "correctAnswerId": "b",
      "explanation": "予約の行為をしたのは、返答するB。",
      "explanationEn": "The act of making a reservation is B.",
      "diagnosticTags": [
        "omitted_subject",
        "dialogue_context"
      ],
      "context": "職場。",
      "contextEn": "Workplace.",
      "jlptLevel": "N4",
      "difficultyScore": 1,
      "grammarPoints": [
        "省略された成分の推定",
        "会話文脈からの照応"
      ],
      "vocabulary": [
        "会議室",
        "取っとく",
        "うん",
        "もう取った"
      ],
      "reviewStatus": "draft",
      "choices": [
        {
          "id": "a",
          "label": "A",
          "labelEn": "A"
        },
        {
          "id": "b",
          "label": "B",
          "labelEn": "B"
        },
        {
          "id": "c",
          "label": "部長",
          "labelEn": "部長 (Director)"
        },
        {
          "id": "d",
          "label": "分からない",
          "labelEn": "分からない (I don't know)"
        }
      ]
    },
    {
      "id": "od_004",
      "type": "multipleChoice",
      "prompt": "誰が傘を持ってきましたか。",
      "promptEn": "Who brought the umbrella?",
      "japanese": "A: 「傘、要る？」\nB: 「持ってきたよ。」",
      "japaneseEn": "A: \"Do you need umbrellas?\"\nB: “I have brought it.”",
      "correctAnswerId": "b",
      "explanation": "持参したのはBの行動と分かる。",
      "explanationEn": "I understand the behavior of B.",
      "diagnosticTags": [
        "omitted_subject",
        "dialogue_context"
      ],
      "context": "駅前。",
      "contextEn": "Close",
      "jlptLevel": "N4",
      "difficultyScore": 1,
      "grammarPoints": [
        "省略された成分の推定",
        "会話文脈からの照応"
      ],
      "vocabulary": [
        "傘",
        "要る",
        "持ってきたよ"
      ],
      "reviewStatus": "draft",
      "choices": [
        {
          "id": "a",
          "label": "A",
          "labelEn": "A"
        },
        {
          "id": "b",
          "label": "B",
          "labelEn": "B"
        },
        {
          "id": "c",
          "label": "店員",
          "labelEn": "店員 (Staff)"
        },
        {
          "id": "d",
          "label": "分からない",
          "labelEn": "分からない (I don't know)"
        }
      ]
    },
    {
      "id": "od_005",
      "type": "multipleChoice",
      "prompt": "誰が宿題を出しますか。",
      "promptEn": "Who gives homework?",
      "japanese": "A: 「宿題、出さないと。」\nB: 「私が出すよ。」",
      "japaneseEn": "A: \"Do not leave homework.\"  \nB: “I’m going out.”",
      "correctAnswerId": "b",
      "explanation": "「出すよ」はBの主語。",
      "explanationEn": "The main word of B.",
      "diagnosticTags": [
        "omitted_subject",
        "dialogue_context"
      ],
      "context": "友達。",
      "contextEn": "Friends",
      "jlptLevel": "N4",
      "difficultyScore": 1,
      "grammarPoints": [
        "省略された成分の推定",
        "会話文脈からの照応"
      ],
      "vocabulary": [
        "宿題",
        "出さないと",
        "私が出すよ"
      ],
      "reviewStatus": "draft",
      "choices": [
        {
          "id": "a",
          "label": "A",
          "labelEn": "A"
        },
        {
          "id": "b",
          "label": "B",
          "labelEn": "B"
        },
        {
          "id": "c",
          "label": "先生",
          "labelEn": "先生 (Teacher)"
        },
        {
          "id": "d",
          "label": "分からない",
          "labelEn": "分からない (I don't know)"
        }
      ]
    },
    {
      "id": "od_006",
      "type": "multipleChoice",
      "prompt": "誰が窓を開けましたか。",
      "promptEn": "Who opened the window?",
      "japanese": "A: 「暑いね。」\nB: 「開けておくね。」",
      "japaneseEn": "A: “It’s hot.”  \nB: “Open!”",
      "correctAnswerId": "b",
      "explanation": "開けるのは話しているB。",
      "explanationEn": "B is talking about opening.",
      "diagnosticTags": [
        "omitted_subject",
        "dialogue_context"
      ],
      "context": "教室。",
      "contextEn": "Classroom",
      "jlptLevel": "N4",
      "difficultyScore": 1,
      "grammarPoints": [
        "省略された成分の推定",
        "会話文脈からの照応"
      ],
      "vocabulary": [
        "暑いね",
        "開けておくね"
      ],
      "reviewStatus": "draft",
      "choices": [
        {
          "id": "a",
          "label": "A",
          "labelEn": "A"
        },
        {
          "id": "b",
          "label": "B",
          "labelEn": "B"
        },
        {
          "id": "c",
          "label": "窓",
          "labelEn": "窓 (Window)"
        },
        {
          "id": "d",
          "label": "分からない",
          "labelEn": "分からない (I don't know)"
        }
      ]
    },
    {
      "id": "od_007",
      "type": "multipleChoice",
      "prompt": "誰がコピーを取りますか。",
      "promptEn": "Who takes a copy?",
      "japanese": "A: 「資料のコピー、頼んでいい？」\nB: 「ああ、こっちでやる。」",
      "japaneseEn": "A: “Do you ask for a copy of materials?”\nB: “Oh, do it here.”",
      "correctAnswerId": "b",
      "explanation": "「こっちでやる」はBが実行する。",
      "explanationEn": "\"Do it here\" executes B.",
      "diagnosticTags": [
        "omitted_subject",
        "dialogue_context"
      ],
      "context": "オフィス。",
      "contextEn": "Office.",
      "jlptLevel": "N4",
      "difficultyScore": 1,
      "grammarPoints": [
        "省略された成分の推定",
        "会話文脈からの照応"
      ],
      "vocabulary": [
        "資料のコピー",
        "頼んでいい",
        "ああ",
        "こっちでやる"
      ],
      "reviewStatus": "draft",
      "choices": [
        {
          "id": "a",
          "label": "A",
          "labelEn": "A"
        },
        {
          "id": "b",
          "label": "B",
          "labelEn": "B"
        },
        {
          "id": "c",
          "label": "コピー機",
          "labelEn": "コピー機 (Copier)"
        },
        {
          "id": "d",
          "label": "分からない",
          "labelEn": "分からない (I don't know)"
        }
      ]
    },
    {
      "id": "od_008",
      "type": "multipleChoice",
      "prompt": "誰が荷物を運びましたか。",
      "promptEn": "Who carried my luggage?",
      "japanese": "A: 「重いねこの箱。」\nB: 「運んだから大丈夫。」",
      "japaneseEn": "A: \"Heavy box.\"  \nB: “It’s okay because you’re lucky.”",
      "correctAnswerId": "b",
      "explanation": "運んだのはBが報告している主体。",
      "explanationEn": "Make sure B reports.",
      "diagnosticTags": [
        "omitted_subject",
        "dialogue_context"
      ],
      "context": "引っ越しの手伝い。",
      "contextEn": "Help of moving.",
      "jlptLevel": "N4",
      "difficultyScore": 1,
      "grammarPoints": [
        "省略された成分の推定",
        "会話文脈からの照応"
      ],
      "vocabulary": [
        "重いねこの箱",
        "運んだから大丈夫"
      ],
      "reviewStatus": "draft",
      "choices": [
        {
          "id": "a",
          "label": "A",
          "labelEn": "A"
        },
        {
          "id": "b",
          "label": "B",
          "labelEn": "B"
        },
        {
          "id": "c",
          "label": "大家",
          "labelEn": "大家 (Home)"
        },
        {
          "id": "d",
          "label": "分からない",
          "labelEn": "分からない (I don't know)"